{
  "schemaVersion": 1,
  "id": "my-direct-stream",
  "name": "URL diretto HLS/DASH/MP4/TS",
  "description": "Un singolo flusso continuo trasformato in canale 24/7.",
  "kind": "direct",
  "defaults": { "language": "", "country": "", "category": "TV" },
  "direct": {
    "url": "https://example.com/live/master.m3u8",
    "name": "Il mio canale",
    "category": "TV",
    "type": "auto"
  }
}
